<?xml version="1.0" encoding="utf-8"?>
<bv:BigVir2084_database xmlns:bv="http://finalassignment.org/XMLbigvir84Schema" xmlns:xsi="http://www.w3.org/2001/XMLSchema-instance" xsi:schemaLocation="http://finalassignment.org/XMLbigvir84Schema XMLSchemabigvir84.xsd">
	<bv:citizens>
		<bv:citizen idCitizen="cit001">
			<bv:personalInformation>
				<bv:name>Samuel</bv:name>
				<bv:surname>Bricot</bv:surname>
				<bv:dateOfBirth>1992-09-12</bv:dateOfBirth>
				<bv:adress>45 rue de la chipo, Le Rheu</bv:adress>
				<bv:zipcode>35650</bv:zipcode>
				<bv:mobilePhoneNumber>0618599098</bv:mobilePhoneNumber>
				<bv:mailAdress>samuel@laposte.net</bv:mailAdress>
			</bv:personalInformation>
			<bv:medicalInformation>
				<bv:sex>M</bv:sex>
				<bv:weightKg>67</bv:weightKg>
				<bv:heightCm>187</bv:heightCm>
				<bv:age>28</bv:age>
				<bv:referentPhysicians>
					<bv:referentPhysician refphysicianId="phy002" speciality="general practitioner"/>
				</bv:referentPhysicians>
				<bv:Allergies>Pollen Fruits Acariens</bv:Allergies>	
			</bv:medicalInformation>
			<bv:medicalHistory>
				<bv:medicalActs>
					<bv:consultation date="2021-06-08" refMedSerId="phy001">
						<bv:consultationResult>Patient present bigvir84 symptomas</bv:consultationResult>
						<bv:prescription>bigvir84 medical test</bv:prescription>
					</bv:consultation>
					<bv:laboratoryTest date="2021-06-09" refMedSerId="lab003">
						<bv:pathologieTested>bigvir84</bv:pathologieTested>
						<bv:testResult>1</bv:testResult>
						<bv:resultDetails>Patient positive to bigvir84 with viral load of 0.6</bv:resultDetails>
					</bv:laboratoryTest>
				</bv:medicalActs>
				<bv:infections>
					<bv:infection pathologie="Tuberculoses" date="2012-07-14"/>		
				</bv:infections>
				<bv:vaccinationStatutes>
					<bv:vaccin date="2006-09-18">
						<bv:pathologie>thetanos</bv:pathologie>
						<bv:upToDate>1</bv:upToDate>
					</bv:vaccin>
					<bv:vaccin date="2002-06-07">
						<bv:pathologie>hepatite A</bv:pathologie>
						<bv:upToDate>1</bv:upToDate>
					</bv:vaccin>	
				</bv:vaccinationStatutes>
			</bv:medicalHistory>
			<bv:socialInformation>
				<bv:socialRelations>
					<bv:contactWithCitId date="2021-06-10" citizenId="cit005">
						<bv:locationAdress latitude="48.111598" longitude="-1.685317">32 rue du chapito Rennes 35000</bv:locationAdress>
					</bv:contactWithCitId>
					<bv:contactWithCitId date="2021-06-10" citizenId="cit003">
					</bv:contactWithCitId>	
				</bv:socialRelations>
				<bv:socialHistory>
					<bv:socialEvent date="2021-06-07">
						<bv:placeOrEventName> Mall Bougaloo </bv:placeOrEventName>
						<bv:placeId>pla002</bv:placeId>
					</bv:socialEvent>
					<bv:socialEvent date="2021-06-07">
						<bv:placeOrEventName> Restaurant des 3 chips </bv:placeOrEventName>
						<bv:placeId>pla001</bv:placeId>
					</bv:socialEvent>
					<bv:socialEvent date="2021-06-04">
						<bv:placeOrEventName> Festival des vieilles charrues</bv:placeOrEventName>
						<bv:eventId>evt001</bv:eventId>
					</bv:socialEvent>
				</bv:socialHistory>
			</bv:socialInformation>
		</bv:citizen>
		
		<bv:citizen idCitizen="cit002">
			<bv:personalInformation>
				<bv:name>Marcelus</bv:name>
				<bv:surname>Conpito</bv:surname>
				<bv:dateOfBirth>1954-02-12</bv:dateOfBirth>
				<bv:adress>3 rue du pistolet, Tours </bv:adress>
				<bv:zipcode>37000</bv:zipcode>
				<bv:fixPhoneNumber>0299641387</bv:fixPhoneNumber>
				<bv:mailAdress>marcelolerigolo@google.net</bv:mailAdress>
			</bv:personalInformation>
			<bv:medicalInformation>
				<bv:sex>M</bv:sex>
				<bv:weightKg>62</bv:weightKg>
				<bv:heightCm>167</bv:heightCm>
				<bv:age>67</bv:age>
				<bv:referentPhysicians>
					<bv:referentPhysician refphysicianId="phy001" speciality="general practitioner"/>
					<bv:referentPhysician refphysicianId="phy005" speciality="cardiologist"/>
				</bv:referentPhysicians>
				<bv:Allergies>Peanut</bv:Allergies>
			</bv:medicalInformation>
			<bv:medicalHistory>
				<bv:medicalActs>
					<bv:consultation date="2021-06-03" refMedSerId="phy001">
						<bv:consultationResult>Patient present bigvir84 symptomas</bv:consultationResult>
						<bv:prescription>bigvir84 medical test</bv:prescription>
					</bv:consultation>
					<bv:laboratoryTest date="2015-03-04" refMedSerId="lab003">
						<bv:pathologieTested>HIV</bv:pathologieTested>
						<bv:testResult>0</bv:testResult>
					</bv:laboratoryTest>
					<bv:laboratoryTest date="2021-06-04" refMedSerId="lab003">
						<bv:pathologieTested>bigvir84</bv:pathologieTested>
						<bv:testResult>1</bv:testResult>
						<bv:resultDetails>Patient positive to bigvir84 with viral load of 0.2</bv:resultDetails>
					</bv:laboratoryTest>
					<bv:surgery date="2012-06-15" refMedSerId="phy005">
						<bv:interventionDescription>Hearth replacement surgery</bv:interventionDescription>
					</bv:surgery>
				</bv:medicalActs>
				<bv:infections>
					<bv:infection pathologie="malaria" date="2014-06-14"/>
				</bv:infections>
				<bv:immunizationStatus>
					<bv:pathologie testDate="2015-06-19">
						<bv:name>H1N1 flu</bv:name>
						<bv:result>negatif</bv:result>
					</bv:pathologie>
					<bv:pathologie testDate="2021-04-15">
						<bv:name>bigvir84</bv:name>
						<bv:result>negatif</bv:result>
					</bv:pathologie>
				</bv:immunizationStatus>
				<bv:vaccinationStatutes>
					<bv:vaccin date="2006-09-18">
						<bv:pathologie>thetanos</bv:pathologie>
						<bv:upToDate>1</bv:upToDate>
					</bv:vaccin>
					<bv:vaccin date="2002-06-07">
						<bv:pathologie>hepatite A</bv:pathologie>
						<bv:upToDate>1</bv:upToDate>
					</bv:vaccin>
				</bv:vaccinationStatutes>
			</bv:medicalHistory>
			<bv:socialInformation>
				<bv:socialRelations>
					<bv:contactWithCitId date="2021-06-09" citizenId="cit004">
						<bv:locationAdress latitude="48.111591" longitude="-1.685311">32 rue du champ jacquet Rennes 35000</bv:locationAdress>
					</bv:contactWithCitId>
					<bv:contactWithCitId date="2021-06-08" citizenId="cit002">
					</bv:contactWithCitId>
				</bv:socialRelations>
				<bv:socialHistory>
					<bv:socialEvent date="2021-06-02">
						<bv:placeOrEventName> Musee des beaux arts </bv:placeOrEventName>
						<bv:placeId>pla003</bv:placeId>
					</bv:socialEvent>
					<bv:socialEvent date="2021-06-07">
						<bv:placeOrEventName> Cinema CGR </bv:placeOrEventName>
						<bv:placeId>pla004</bv:placeId>
					</bv:socialEvent>
					<bv:socialEvent date="2021-06-09">
						<bv:placeOrEventName> Rolland Garos </bv:placeOrEventName>
						<bv:eventId>evt005</bv:eventId>
					</bv:socialEvent>
				</bv:socialHistory>
			</bv:socialInformation>
		</bv:citizen>
		
		<bv:citizen idCitizen="cit003">
			<bv:personalInformation>
				<bv:name>Josianne</bv:name>
				<bv:surname>Garibaldi</bv:surname>
				<bv:dateOfBirth>1948-01-12</bv:dateOfBirth>
				<bv:adress>35 rue du pipo, Paris</bv:adress>
				<bv:zipcode>75013</bv:zipcode>
				<bv:fixPhoneNumber>0299641387</bv:fixPhoneNumber>
				<bv:mailAdress>josijozee@gmail.net</bv:mailAdress>
			</bv:personalInformation>
			<bv:medicalInformation>
				<bv:sex>F</bv:sex>
				<bv:weightKg>52</bv:weightKg>
				<bv:heightCm>163</bv:heightCm>
				<bv:age>73</bv:age>
				<bv:medications>
					<bv:medication>
						<bv:drugName>buronzan</bv:drugName>
						<bv:dailyDosage>125 mg</bv:dailyDosage>
						<bv:startDate>2019-05-01</bv:startDate>
					</bv:medication>
					<bv:medication>
						<bv:drugName>maxipropulsator</bv:drugName>
						<bv:dailyDosage>1300 mg</bv:dailyDosage>
						<bv:startDate>2018-02-28</bv:startDate>
					</bv:medication>
				</bv:medications>
				<bv:referentPhysicians>
					<bv:referentPhysician refphysicianId="phy002" speciality="general practitioner"/>
					<bv:referentPhysician refphysicianId="phy006" speciality="pulmonologist"/>
				</bv:referentPhysicians>
			</bv:medicalInformation>
			<bv:medicalHistory>
				<bv:medicalActs>
					<bv:consultation date="2020-06-03" refMedSerId="phy002">
						<bv:consultationResult>Patient has the flue</bv:consultationResult>
						<bv:prescription>sleep/soup and ibuprofène</bv:prescription>
					</bv:consultation>
					<bv:laboratoryTest date="2016-03-04" refMedSerId="lab003">
						<bv:pathologieTested>Syphilis</bv:pathologieTested>
						<bv:testResult>0</bv:testResult>
					</bv:laboratoryTest>
					<bv:laboratoryTest date="2021-06-10" refMedSerId="lab002">
						<bv:pathologieTested>bigvir84</bv:pathologieTested>
						<bv:testResult>1</bv:testResult>
						<bv:resultDetails>Patient positive to bigvir84 with viral load of 0.5</bv:resultDetails>
					</bv:laboratoryTest>
					<bv:surgery date="2012-06-15" refMedSerId="phy007">
						<bv:interventionDescription>brain implant</bv:interventionDescription>
					</bv:surgery>
					<bv:hospitalisation date="2012-06-14" refMedSerId="hosp001">
						<bv:reason>brain surgery</bv:reason>
						<bv:lengthInDays>15</bv:lengthInDays>
					</bv:hospitalisation>
				</bv:medicalActs>
				<bv:vaccinationStatutes>
					<bv:vaccin date="2003-05-18">
						<bv:pathologie>thetanos</bv:pathologie>
						<bv:upToDate>1</bv:upToDate>
					</bv:vaccin>
					<bv:vaccin date="2001-06-07">
						<bv:pathologie>hepatite A</bv:pathologie>
						<bv:upToDate>0</bv:upToDate>
					</bv:vaccin>
					<bv:vaccin date="2021-05-07">
						<bv:pathologie>bigvir84</bv:pathologie>
						<bv:upToDate>1</bv:upToDate>
					</bv:vaccin>
				</bv:vaccinationStatutes>
			</bv:medicalHistory>
			<bv:socialInformation>
				<bv:socialRelations>
					<bv:contactWithCitId date="2021-06-09" citizenId="cit002">
						<bv:locationAdress latitude="48.1135463" longitude="1.6855455">45 rue de la pompe, 75002, Paris, France</bv:locationAdress>
					</bv:contactWithCitId>